[
  {
    "name": "GeForce 256 SDR",
    "year": 1999,
    "manufacturer": "NVIDIA",
    "series": "GeForce",
    "architecture": "NV10",
    "process_nm": 220,
    "transistors_millions": 23,
    "die_size_mm2": 139,
    "cuda_cores": null,
    "stream_processors": null,
    "execution_units": null,
    "tensor_cores": null,
    "rt_cores": null,
    "base_clock_mhz": 120,
    "boost_clock_mhz": 120,
    "vram_mb": 32,
    "memory_type": "SDR",
    "memory_bus_width": 128,
    "memory_bandwidth_gbps": 2.9,
    "memory_clock_mhz": 166,
    "tflops_fp32": 0.48,
    "tflops_fp16": 0.0,
    "tflops_int8": 0.0,
    "ray_tracing_tflops": null,
    "tdp_watts": 30,
    "power_connectors": "None",
    "launch_price_usd": 299,
    "directx_version": "7.0",
    "opengl_version": "1.2",
    "vulkan_support": false,
    "ray_tracing_support": false,
    "dlss_support": false,
    "fsr_support": false,
    "xess_support": false,
    "max_displays": 2,
    "max_resolution": "2048x1536",
    "release_date": "1999-10",
    "notes": "First GPU with hardware T&L - coined the term 'GPU'"
  },
  {
    "name": "Radeon 7500",
    "year": 2001,
    "manufacturer": "AMD",
    "series": "Radeon",
    "architecture": "R200",
    "process_nm": 150,
    "transistors_millions": 30,
    "die_size_mm2": 81,
    "cuda_cores": null,
    "stream_processors": 64,
    "execution_units": null,
    "tensor_cores": null,
    "rt_cores": null,
    "base_clock_mhz": 290,
    "boost_clock_mhz": 290,
    "vram_mb": 64,
    "memory_type": "DDR",
    "memory_bus_width": 128,
    "memory_bandwidth_gbps": 7.4,
    "memory_clock_mhz": 230,
    "tflops_fp32": 1.2,
    "tflops_fp16": 0.0,
    "tflops_int8": 0.0,
    "ray_tracing_tflops": null,
    "tdp_watts": 25,
    "power_connectors": "None",
    "launch_price_usd": 199,
    "directx_version": "8.1",
    "opengl_version": "1.3",
    "vulkan_support": false,
    "ray_tracing_support": false,
    "dlss_support": false,
    "fsr_support": false,
    "xess_support": false,
    "max_displays": 2,
    "max_resolution": "2048x1536",
    "release_date": "2001-02",
    "notes": "Affordable mainstream GPU with dual display support"
  },
  {
    "name": "GeForce 6800 Ultra",
    "year": 2004,
    "manufacturer": "NVIDIA",
    "series": "GeForce 6",
    "architecture": "NV40",
    "process_nm": 130,
    "transistors_millions": 222,
    "die_size_mm2": 287,
    "cuda_cores": null,
    "stream_processors": null,
    "execution_units": null,
    "tensor_cores": null,
    "rt_cores": null,
    "base_clock_mhz": 400,
    "boost_clock_mhz": 400,
    "vram_mb": 256,
    "memory_type": "GDDR3",
    "memory_bus_width": 256,
    "memory_bandwidth_gbps": 35.2,
    "memory_clock_mhz": 550,
    "tflops_fp32": 5.6,
    "tflops_fp16": 0.0,
    "tflops_int8": 0.0,
    "ray_tracing_tflops": null,
    "tdp_watts": 110,
    "power_connectors": "6-pin",
    "launch_price_usd": 499,
    "directx_version": "9.0c",
    "opengl_version": "2.0",
    "vulkan_support": false,
    "ray_tracing_support": false,
    "dlss_support": false,
    "fsr_support": false,
    "xess_support": false,
    "max_displays": 2,
    "max_resolution": "2560x1600",
    "release_date": "2004-04",
    "notes": "First PCI Express GPU, shader model 3.0"
  },
  {
    "name": "Radeon X1900 XTX",
    "year": 2006,
    "manufacturer": "AMD",
    "series": "Radeon X1000",
    "architecture": "R580",
    "process_nm": 90,
    "transistors_millions": 384,
    "die_size_mm2": 352,
    "cuda_cores": null,
    "stream_processors": 384,
    "execution_units": null,
    "tensor_cores": null,
    "rt_cores": null,
    "base_clock_mhz": 650,
    "boost_clock_mhz": 650,
    "vram_mb": 512,
    "memory_type": "GDDR3",
    "memory_bus_width": 256,
    "memory_bandwidth_gbps": 76.8,
    "memory_clock_mhz": 750,
    "tflops_fp32": 8.0,
    "tflops_fp16": 0.0,
    "tflops_int8": 0.0,
    "ray_tracing_tflops": null,
    "tdp_watts": 160,
    "power_connectors": "6-pin + 6-pin",
    "launch_price_usd": 649,
    "directx_version": "9.0c",
    "opengl_version": "2.0",
    "vulkan_support": false,
    "ray_tracing_support": false,
    "dlss_support": false,
    "fsr_support": false,
    "xess_support": false,
    "max_displays": 2,
    "max_resolution": "2560x1600",
    "release_date": "2006-01",
    "notes": "First 512MB GPU, ultra-threaded architecture"
  },
  {
    "name": "GeForce 8800 GTX",
    "year": 2006,
    "manufacturer": "NVIDIA",
    "series": "GeForce 8",
    "architecture": "Tesla (G80)",
    "process_nm": 90,
    "transistors_millions": 681,
    "die_size_mm2": 484,
    "cuda_cores": 128,
    "stream_processors": null,
    "execution_units": null,
    "tensor_cores": null,
    "rt_cores": null,
    "base_clock_mhz": 575,
    "boost_clock_mhz": 575,
    "vram_mb": 768,
    "memory_type": "GDDR3",
    "memory_bus_width": 384,
    "memory_bandwidth_gbps": 86.4,
    "memory_clock_mhz": 900,
    "tflops_fp32": 13.8,
    "tflops_fp16": 0.0,
    "tflops_int8": 0.0,
    "ray_tracing_tflops": null,
    "tdp_watts": 155,
    "power_connectors": "6-pin",
    "launch_price_usd": 599,
    "directx_version": "10.0",
    "opengl_version": "2.1",
    "vulkan_support": false,
    "ray_tracing_support": false,
    "dlss_support": false,
    "fsr_support": false,
    "xess_support": false,
    "max_displays": 2,
    "max_resolution": "2560x1600",
    "release_date": "2006-11",
    "notes": "First unified shader architecture, introduced CUDA"
  },
  {
    "name": "Radeon HD 4870",
    "year": 2008,
    "manufacturer": "AMD",
    "series": "Radeon HD 4000",
    "architecture": "TeraScale (RV770)",
    "process_nm": 55,
    "transistors_millions": 956,
    "die_size_mm2": 256,
    "cuda_cores": null,
    "stream_processors": 800,
    "execution_units": null,
    "tensor_cores": null,
    "rt_cores": null,
    "base_clock_mhz": 750,
    "boost_clock_mhz": 750,
    "vram_mb": 512,
    "memory_type": "GDDR5",
    "memory_bus_width": 256,
    "memory_bandwidth_gbps": 115.2,
    "memory_clock_mhz": 900,
    "tflops_fp32": 1.2,
    "tflops_fp16": 0.0,
    "tflops_int8": 0.0,
    "ray_tracing_tflops": null,
    "tdp_watts": 160,
    "power_connectors": "6-pin + 6-pin",
    "launch_price_usd": 299,
    "directx_version": "10.1",
    "opengl_version": "3.2",
    "vulkan_support": false,
    "ray_tracing_support": false,
    "dlss_support": false,
    "fsr_support": false,
    "xess_support": false,
    "max_displays": 2,
    "max_resolution": "2560x1600",
    "release_date": "2008-06",
    "notes": "First GPU with GDDR5 memory"
  },
  {
    "name": "GeForce GTX 480",
    "year": 2010,
    "manufacturer": "NVIDIA",
    "series": "GeForce GTX 400",
    "architecture": "Fermi (GF100)",
    "process_nm": 40,
    "transistors_millions": 3000,
    "die_size_mm2": 529,
    "cuda_cores": 480,
    "stream_processors": null,
    "execution_units": null,
    "tensor_cores": null,
    "rt_cores": null,
    "base_clock_mhz": 700,
    "boost_clock_mhz": 700,
    "vram_mb": 1536,
    "memory_type": "GDDR5",
    "memory_bus_width": 384,
    "memory_bandwidth_gbps": 177.4,
    "memory_clock_mhz": 924,
    "tflops_fp32": 1.35,
    "tflops_fp16": 0.0,
    "tflops_int8": 0.0,
    "ray_tracing_tflops": null,
    "tdp_watts": 250,
    "power_connectors": "6-pin + 8-pin",
    "launch_price_usd": 499,
    "directx_version": "11.0",
    "opengl_version": "4.1",
    "vulkan_support": false,
    "ray_tracing_support": false,
    "dlss_support": false,
    "fsr_support": false,
    "xess_support": false,
    "max_displays": 2,
    "max_resolution": "2560x1600",
    "release_date": "2010-03",
    "notes": "First Fermi architecture, enhanced double precision"
  },
  {
    "name": "Radeon HD 7970",
    "year": 2011,
    "manufacturer": "AMD",
    "series": "Radeon HD 7000",
    "architecture": "GCN 1.0 (Tahiti)",
    "process_nm": 28,
    "transistors_millions": 4313,
    "die_size_mm2": 365,
    "cuda_cores": null,
    "stream_processors": 2048,
    "execution_units": null,
    "tensor_cores": null,
    "rt_cores": null,
    "base_clock_mhz": 925,
    "boost_clock_mhz": 925,
    "vram_mb": 3072,
    "memory_type": "GDDR5",
    "memory_bus_width": 384,
    "memory_bandwidth_gbps": 264,
    "memory_clock_mhz": 1375,
    "tflops_fp32": 3.79,
    "tflops_fp16": 0.0,
    "tflops_int8": 0.0,
    "ray_tracing_tflops": null,
    "tdp_watts": 250,
    "power_connectors": "6-pin + 8-pin",
    "launch_price_usd": 549,
    "directx_version": "11.1",
    "opengl_version": "4.2",
    "vulkan_support": true,
    "ray_tracing_support": false,
    "dlss_support": false,
    "fsr_support": false,
    "xess_support": false,
    "max_displays": 6,
    "max_resolution": "4096x2160",
    "release_date": "2011-12",
    "notes": "First 28nm GPU, GCN architecture debut"
  },
  {
    "name": "GeForce GTX 680",
    "year": 2012,
    "manufacturer": "NVIDIA",
    "series": "GeForce GTX 600",
    "architecture": "Kepler (GK104)",
    "process_nm": 28,
    "transistors_millions": 3540,
    "die_size_mm2": 294,
    "cuda_cores": 1536,
    "stream_processors": null,
    "execution_units": null,
    "tensor_cores": null,
    "rt_cores": null,
    "base_clock_mhz": 1006,
    "boost_clock_mhz": 1058,
    "vram_mb": 2048,
    "memory_type": "GDDR5",
    "memory_bus_width": 256,
    "memory_bandwidth_gbps": 192.2,
    "memory_clock_mhz": 1502,
    "tflops_fp32": 3.25,
    "tflops_fp16": 0.0,
    "tflops_int8": 0.0,
    "ray_tracing_tflops": null,
    "tdp_watts": 195,
    "power_connectors": "6-pin + 6-pin",
    "launch_price_usd": 499,
    "directx_version": "11.0",
    "opengl_version": "4.3",
    "vulkan_support": true,
    "ray_tracing_support": false,
    "dlss_support": false,
    "fsr_support": false,
    "xess_support": false,
    "max_displays": 4,
    "max_resolution": "4096x2160",
    "release_date": "2012-03",
    "notes": "Kepler architecture, GPU Boost technology"
  },
  {
    "name": "GeForce GTX 780 Ti",
    "year": 2013,
    "manufacturer": "NVIDIA",